23,1,2017-02-16 22:20:02,2017-02-16 22:20:02,"This Easter, celebrate the beauty of everyday faith and hope. Coming to theaters March 18, MIRACLES FROM HEAVEN is based on the true story of the Beam family as they encounter God's unfailing love and constant presence during an incredible journey from hardship to healing.

Starring Jennifer Garner, Martin Henderson, Kylie Rogers with Eugenio Derbez and Queen Latifah, MIRACLES FROM HEAVEN is based on the incredible true story and memoir of Christy Beam (Jennifer Garner). When Christy discovers her 10-year-old daughter Anna (Kylie Rogers) has a rare, incurable disease, she becomes a ferocious advocate for her daughter’s healing as she searches for a solution. As Christy searches she befriends Angela Bradford (Queen Latifah), who helps bring everyday joy and hope back to the Beam family. After Anna has a freak accident, an extraordinary miracle unfolds in the wake of her dramatic rescue that leaves medical specialists mystified, her family’s faith restored and their community inspired. Directed by Patricia Riggen. Screenplay by Randy Brown based on the book by Christy Beam. Produced by Joe Roth, T.D. Jakes and DeVon Franklin.",Miracles From Heaven,,publish,0,closed,,miracles-from-heaven,,,2017-06-22 21:26:42,2017-06-22 21:26:42,,0,http://lovell-fairchild.dev//?post_type=clients&#038;p=23,211,clients,,0,,http://lovell-fairchild.dev//wp-content/uploads/2017/04/miracles-heaven.jpg,53,field_58ade3ae908d7,53,field_58dabaae72c48,53,field_58dabbab72c49,http://www.miraclesfromheaven-movie.com/,field_58f1567cc0ddb,,field_5900d5e0fc781,,field_59372df65dbf8,,
25,1,2017-02-17 16:57:33,2017-02-17 16:57:33,"Risen is the epic Biblical story of the resurrection and the weeks that followed, as seen through the eyes of an unbelieving Clavius (Joseph Fiennes), a high-ranking Roman military tribune.  Clavius and his aide Lucius (Tom Felton) are instructed by Pontius Pilate to oversee the execution of Jesus of Nazareth, and to ensure his radical followers don’t steal the body and claim resurrection.  Despite the tomb’s protection by Roman guards, the body goes missing within days.  Clavius is charged to locate the missing body in order to prevent an imminent uprising in Jerusalem.  Only by finding the remains of Jesus can they disprove the rumors of a risen Messiah, allowing Rome to retain control of Judea.  However, along Clavius’ mission, his doubts of such a supernatural occurrence begin to fade away as he encounters the Apostles and other followers while piecing together the mysterious events that unfolded after the Crucifixion.",Risen,,publish,0,closed,,risen,,,2017-06-22 21:26:39,2017-06-22 21:26:39,,0,http://lovell-fairchild.dev//?post_type=clients&#038;p=25,207,clients,,0,,http://lovell-fairchild.dev//wp-content/uploads/2017/02/risen.jpg,,field_58ade3ae908d7,159,field_58dabaae72c48,,field_58dabbab72c49,https://www.facebook.com/risenmovie?ref=ts&fref=ts,field_58f1567cc0ddb,https://drive.google.com/drive/folders/0B7NzR-q_QBryMTlLUTh0c3RoLW8,field_5900d5e0fc781,,field_59372df65dbf8,,
57,1,2017-02-21 00:57:34,2017-02-21 00:57:34,"Pastor Don Piper died January 18, 1989 when a semi-tractor truck crushed his car. Declared dead by the first rescue workers to arrive on the scene, Don's body lay under a tarp for the next 90 minutes. Don's soul, meanwhile, was experiencing love, joy, and life like he'd never known before. Don was in Heaven.

When another pastors prayers helped bring Don back to life, he became a living miracle! Yet this is one miracle Don wished never happened. Heavens bliss was replaced by excruciating pain and emotional turmoil. With the support and prayers of his beloved Eva, their three kids, and friends near and far, Don clings to his faith in God and fights to regain a semblance of his previous life. The Piper family's incredible true story of perseverance and overcoming the challenges of life and death will bring hope and encouragement to all who see it.

Starring Hayden Christensen and Kate Bosworth, 90 MINUTES IN HEAVEN is based on the inspiring book that has sold 7 million copies. In theaters everywhere this fall, Hope Lives!",90 Minutes In Heaven,,publish,0,closed,,90-minutes-in-heaven,,,2017-06-01 22:21:09,2017-06-01 22:21:09,,0,http://lovell-fairchild.dev//?post_type=clients&#038;p=57,208,clients,,0,54,field_58ade3ae908d7,636,field_58dabaae72c48,54,field_58dabbab72c49,http://90minutesinheaventhemovie.com/,field_58f1567cc0ddb,,http://lovell-fairchild.dev//wp-content/uploads/2017/04/90-min-heaven.jpg,,
58,1,2017-02-21 00:58:36,2017-02-21 00:58:36,"The name ""Sight &amp; Sound"" was inspired by the teaching of Jesus found in Matthew 13:10-23. The disciples asked Jesus why he spoke to the people in parables or stories. Jesus replied that even though people were seeing, they did not really see. Even though they were hearing, they did not truly hear or understand what they heard.

It is our goal to visualize and dramatize Biblical truth through live stage productions - to illustrate truth in the same way that Jesus did, by storytelling. Our desire is that our audience will gain clear understanding and inspiration through these presentations, believe in the Lord Jesus Christ and deepen their relationship with our Father through Him.

Our purpose is to present the Gospel of Jesus Christ and sow the Word of God into the lives of our customers, guests and fellow workers by visualizing and dramatizing the scriptures, through inspirational productions, encouraging others and seeking always to be dedicated and wise stewards of our God-given talents and resources.",Sight & Sound Theaters,,publish,0,closed,,sight-sound-theaters,,,2017-06-01 22:21:09,2017-06-01 22:21:09,,0,http://lovell-fairchild.dev//?post_type=clients&#038;p=58,212,clients,,0,56,field_58ade3ae908d7,56,field_58dabaae72c48,56,field_58dabbab72c49,,http://lovell-fairchild.dev//wp-content/uploads/2017/02/sight-and-sound-theater.jpg,,
59,1,2017-02-21 01:01:57,2017-02-21 01:01:57,"In this interactive, companion study to The Three Heavens, John Hagee will guide you through a tour of the heavenly principalities, outlining their character and purpose. Discover the truth about these spiritual beings through scriptural examination and study. 208 pages, paperback.",Angels & Demons,,publish,0,closed,,angels-demons,,,2017-06-01 22:21:09,2017-06-01 22:21:09,,0,http://lovell-fairchild.dev//?post_type=clients&#038;p=59,209,clients,,0,51,field_58ade3ae908d7,180,field_58dabaae72c48,51,field_58dabbab72c49,,http://lovell-fairchild.dev//wp-content/uploads/2017/02/angels-and-demons.jpg,,
60,1,2017-02-21 01:02:49,2017-02-21 01:02:49,"In July 2014, Dr. Kent Brantly and Nancy Writebol received a death sentence. They were medical missionaries—Kent with international relief organization Samaritan’s Purse and Nancy with SIM—working in ELWA Hospital in Liberia. As they fought a surging epidemic of the killer virus Ebola, a crisis the world largely ignored, Kent and Nancy caught the disease themselves.

The team at Samaritan’s Purse worked around the clock toward the only hope for Brantly and Writebol. It was something that had never been done—evacuate the Ebola patients to the U.S. for treatment and cure.",Facing Darkness,,publish,0,closed,,facing-darkness,,,2017-06-07 19:40:40,2017-06-07 19:40:40,,0,http://lovell-fairchild.dev//?post_type=clients&#038;p=60,210,clients,,0,52,field_58ade3ae908d7,52,field_58dabaae72c48,52,field_58dabbab72c49,,http://lovell-fairchild.dev//wp-content/uploads/2017/02/facing-darkness-1.jpg,http://facingdarknessmovie.com/,field_58f1567cc0ddb,,field_5900d5e0fc781,,field_59372df65dbf8,,
160,1,2017-03-30 17:13:43,2017-03-30 17:13:43,"Logan Chandler (John Major Davis) is a rising star in the world of mixed martial arts, but when his gym-owner father dies while training him, Logan leaves the ring. He finds romance with a young woman of deep faith (Lelia Symington) and seeks to overcome his troubled past and build a new life. But his new faith is tested when a local MMA professional (Matt Leddo)—whose only losing fight was to Logan—forces him back into the cage.",The Fight Within,,publish,0,closed,,the-fight-within,,,2017-06-22 21:26:45,2017-06-22 21:26:45,,0,http://lovell-fairchild.dev//?post_type=clients&#038;p=160,213,clients,,0,,http://lovell-fairchild.dev//wp-content/uploads/2017/03/The-Fight-Within_poster_goldposter_com_1.jpg@0o_0l_800w_80q.jpg,161,field_58ade3ae908d7,161,field_58dabaae72c48,,field_58dabbab72c49,,field_58f1567cc0ddb,,field_5900d5e0fc781,,field_59372df65dbf8,
184,1,2017-04-09 18:15:48,2017-04-09 18:15:48,"Award-winning radio personality, author, wit, storyteller . . . riveting speaker and more, Brant Hansen connects audiences to the heart the story. Multiple-time winner of national ""Personality of the Year"" awards, Brant currently reaches more than 2 million people through his radio show, syndicated on more than 200 stations. A skeptic who came to faith, Brant is equally engaging for general and faith audiences. Given his passion for people in need, Brant is designated storyteller for CURE International, which facilitates medical treatment and spiritual encouragement across 30 countries for children with disabilities.",Brant Hansen,,publish,0,closed,,brant-hansen,,,2017-06-01 22:21:06,2017-06-01 22:21:06,,0,http://lovell-fairchild.dev//?post_type=clients&#038;p=184,25,clients,,0,,http://lovell-fairchild.dev//wp-content/uploads/2017/04/avatars-000282241743-pzgf6w-t500x500.jpg,185,field_58ade3ae908d7,185,field_58dabaae72c48,185,field_58dabbab72c49,http://branthansen.com/,field_58f1567cc0ddb,https://drive.google.com/drive/folders/0B7NzR-q_QBryOWNHeEVkel9XdE0,field_5900d5e0fc781,
186,1,2017-04-09 20:31:28,2017-04-09 20:31:28,"John Hollar, a struggling NYC artist is forced to navigate the small middle-American town he left behind when news of his mother’s illness brings him home. Back in the house he grew up in, John is immediately swept up in the problems of his dysfunctional family, high school rival, and an over-eager ex-girlfriend as he faces impending fatherhood with his girlfriend in New York.

From a script by Jim Strouse that is at turns hilarious and heartbreaking, John Krasiniski’s second feature is a poignant look at the bonds of family and friendship.",The Hollars,,publish,0,closed,,the-hollars,,,2017-07-12 16:34:31,2017-07-12 16:34:31,,0,http://lovell-fairchild.dev//?post_type=clients&#038;p=186,158,clients,,0,,http://lovell-fairchild.dev//wp-content/uploads/2017/03/hollars.jpg,168,field_58ade3ae908d7,168,field_58dabaae72c48,168,field_58dabbab72c49,http://sonyclassics.com/thehollars/,field_58f1567cc0ddb,https://drive.google.com/drive/folders/0B7NzR-q_QBryNU9ab3BQMnNxZ28,field_5900d5e0fc781,
199,1,2017-04-13 18:09:02,2017-04-13 18:09:02,"In Sony Pictures Animation's THE STAR, a small but brave donkey named Bo yearns for a life beyond his daily grind at the village mill. One day he finds the courage to break free, and finally goes on the adventure of his dreams. On his journey, he teams up with Ruth, a lovable sheep who has lost her flock and Dave, a dove with lofty aspirations. Along with three wisecracking camels and some eccentric stable animals, Bo and his new friends follow the Star and become accidental heroes in the greatest story ever told – the first Christmas.

THE STAR is directed by Academy Award® nominated writer/director Timothy Reckart (HEAD OVER HEELS); executive-produced by DeVon Franklin (MIRACLES FROM HEAVEN), Lisa Henson and Brian Henson (The Jim Henson Company); produced by Jenni Magee Cook; with a story by Carlos Kotkin and Simon Moore; and screenplay by Carlos Kotkin. Digital animation by Cinesite Studios.",The Star,,publish,0,closed,,the-star,,,2017-07-12 16:34:37,2017-07-12 16:34:37,,0,http://lovell-fairchild.dev//?post_type=clients&#038;p=199,107,clients,,0,,field_58ade3ae908d7,238,field_58dabaae72c48,,field_58dabbab72c49,http://www.thestarmovie.com/,field_58f1567cc0ddb,https://drive.google.com/drive/folders/0B7NzR-q_QBryb0E0azlIaThiejg,field_5900d5e0fc781,
250,1,2017-04-13 23:55:39,2017-04-13 23:55:39,"Sam Atwell (Alex Russell) stands on stage as thousands of fans go wild. Smart, charismatic, handsome, he moves them with his message, and when he calls for donations to his charity, the money pours in.

Only thing, Sam doesn’t believe a word he’s saying.

Just months earlier, Sam was a typical college senior focused on keg stands, hookups and graduation. But when a surprise tuition bill threatens his dream of law school and leaves him thousands of dollars in the hole, he’s forced to think outside the box. Convincing his three roommates they can make a killing exploiting the gullible church crowd, the guys start a sham charity and begin campaigning across the country, raising funds for a cause as fake as their message.

For Sam, embezzling money is easy compared to getting attention from the person he cares about the most. When Callie (Johanna Braddy), the tour manager and Sam’s love interest, finally uncovers the guys’ ruse, it's Sam's moment of truth.

On the final night of the tour, before a packed auditorium but alone in the spotlight, it’s time for Sam Atwell to decide what he really believes.",Believe Me,,publish,0,closed,,believe-me,,,2017-07-10 18:58:11,2017-07-10 18:58:11,,0,http://lovell-fairchild.dev//?post_type=clients&#038;p=250,4,clients,,0,,field_58ade3ae908d7,638,field_58dabaae72c48,,field_58dabbab72c49,http://www.believemefilm.com/,field_58f1567cc0ddb,,http://lovell-fairchild.dev//wp-content/uploads/2017/04/believe-me.jpg,https://drive.google.com/drive/folders/0B7NzR-q_QBryWjljR3RiQVhSSGs,field_5900d5e0fc781,,field_59372df65dbf8,
252,1,2017-04-13 23:56:12,2017-04-13 23:56:12,"The leading mercenary for the British East India Company, Will Reynolds, was double-crossed and now is on the run in the American colonies. To redeem his name and win back the woman he loves, Will hides behind a new mask, this time hoping to thwart his former employer. As his past life closes in on him, Will must gain the trust and help of his beloved Charlotte—and Ben Franklin!—as he races time to defuse a plot of historical proportions. BEYOND THE MASK is a revolutionary new family film bringing history to life in a faith-filled adventure that celebrates grace, liberty and the true freedom only in Christ.",Beyond The Mask,,publish,0,closed,,beyond-the-mask,,,2017-07-10 18:58:11,2017-07-10 18:58:11,,0,http://lovell-fairchild.dev//?post_type=clients&#038;p=252,6,clients,,0,,field_58ade3ae908d7,510,field_58dabaae72c48,,field_58dabbab72c49,http://beyondthemaskmovie.com/,field_58f1567cc0ddb,,http://lovell-fairchild.dev//wp-content/uploads/2017/04/beyondthemask.jpg,https://drive.google.com/drive/folders/0B7NzR-q_QBryQUlSTmJ3Nlh2LU0,field_5900d5e0fc781,
254,1,2017-04-13 23:59:00,2017-04-13 23:59:00,"Brothers At War is an intimate portrait of an American family during a turbulent time.  Jake Rademacher sets out to understand the experience, sacrifice, and motivation of his two brothers serving in Iraq. The film follows Jake’s exploits as he risks everything—including his life—to tell his brothers’ story.  Often humorous but sometimes downright lethal, BROTHERS AT WAR is a remarkable journey in which Jake embeds with four combat units in Iraq. Unprecedented access to U.S. and Iraqi combat units take him behind the camouflage curtain with secret reconnaissance troops on the Syrian border, into sniper ""hide sites"" in the Sunni Triangle, through raging machine-gun battles with the Iraqi Army.  Ultimately, the film follows his brothers home where separations and life-threatening work ripple through their parents, siblings, wives, and children. BROTHERS AT WAR is a rare look at the bonds and service of our soldiers on the frontlines and the profound effect their service has on the loved ones they leave behind.",Brothers At War,,publish,0,closed,,brothers-at-war,,,2017-06-22 19:59:25,2017-06-22 19:59:25,,0,http://lovell-fairchild.dev//?post_type=clients&#038;p=254,27,clients,,0,,field_58ade3ae908d7,640,field_58dabaae72c48,,field_58dabbab72c49,http://www.brothersatwarmovie.com/,field_58f1567cc0ddb,,http://lovell-fairchild.dev//wp-content/uploads/2017/04/brothers-at-war-press-event.jpg,https://drive.google.com/drive/folders/0B7NzR-q_QBryOURtazZzbkVjMXM,field_5900d5e0fc781,,field_59372df65dbf8,
256,1,2017-04-14 00:06:35,2017-04-14 00:06:35,"This eight-DVD series updates and expands Dr. James Dobson’s groundbreaking 1979 film series on parenting, at the time viewed by more than 80 million people worldwide. Now three films from the original series join five all-new segments filmed before standing-room-only audiences in San Diego, Riverside and San Antonio.",Building A Family Legacy With Dr. James Dobson,,publish,0,closed,,building-a-family-legacy,,,2017-06-22 19:58:35,2017-06-22 19:58:35,,0,http://lovell-fairchild.dev//?post_type=clients&#038;p=256,30,clients,,0,,field_58ade3ae908d7,641,field_58dabaae72c48,,field_58dabbab72c49,https://direct.cornerstone.cc/FamilyTalk+Shop/item/building_a_family_legacy_8_dvd_set__dvd_,field_58f1567cc0ddb,,http://lovell-fairchild.dev//wp-content/uploads/2017/04/build-fam-legacy.jpg,,field_5900d5e0fc781,,field_59372df65dbf8,
258,1,2017-04-14 00:07:26,2017-04-14 00:07:26,"Four men, one calling: to serve and protect. As law enforcement officers, they face danger every day. Yet when tragedy strikes close to home, these fathers are left wrestling with their hopes, their fears, and their faith. From this struggle will come a decision that changes all of their lives.

With action, drama, and humor, the fourth film from Sherwood Pictures embraces God’s promise to “turn the hearts of fathers to their children, and the hearts of children to their fathers.” Souls will be stirred, and hearts will be challenged to be courageous.",Courageous,,publish,0,closed,,courageous,,,2017-06-22 20:06:44,2017-06-22 20:06:44,,0,http://lovell-fairchild.dev//?post_type=clients&#038;p=258,45,clients,,0,,field_58ade3ae908d7,643,field_58dabaae72c48,,field_58dabbab72c49,http://www.courageousthemovie.com/,field_58f1567cc0ddb,,http://lovell-fairchild.dev//wp-content/uploads/2017/04/courageous.jpg,https://drive.google.com/drive/folders/0B7NzR-q_QBryX2xrcG9uTTFwQVE,field_5900d5e0fc781,,field_59372df65dbf8,
259,1,2017-04-14 00:08:29,2017-04-14 00:08:29,"So a church in Albany GA makes a movie about a football coach that can’t win for losing.  The story is homegrown, written by a church minister and his brother.  The cast amounts to church members with free nights and weekends, and some vacation time.  Sunday school classes handle the catering. Long story short: FACING THE GIANTS made it into the hands of Provident Films, a Sony Pictures sister company.  The rest, no kidding, is filmmaking history.  GIANTS made more than $10 million at the box office, sold DVDs in the millions, and fanned out to every continent, in 20-plus languages.  “With God’s help, I’m learning to face my giants,” thousands emailed to Sherwood Church.

Lovell-Fairchild Communications worked with Provident Films, taking news of this new kind of Christian film to churches feeling long overdue to see (and make use of) faith on the big screen.  Media such as CNN, NBC, FOX, Variety, and many more, were charmed by the church-that-could and the film that did.",Facing The Giants,,publish,0,closed,,facing-the-giants,,,2017-06-22 20:09:08,2017-06-22 20:09:08,,0,http://lovell-fairchild.dev//?post_type=clients&#038;p=259,55,clients,,0,,field_58ade3ae908d7,511,field_58dabaae72c48,,field_58dabbab72c49,http://www.facingthegiants.com/,field_58f1567cc0ddb,,http://lovell-fairchild.dev//wp-content/uploads/2017/04/facinggiants.jpg,https://drive.google.com/drive/folders/0B7NzR-q_QBrycDU5NjNxekU1UzQ,field_5900d5e0fc781,,field_59372df65dbf8,
260,1,2017-04-14 16:01:55,2017-04-14 16:01:55,"With the Vietnam War raging in 1969, two young fathers report for duty. A man of
great faith and a doubtful cynic. A quarter-century later, their sons, Wayne and
John Paul (David A.R. White and Kevin Downes), meet as strangers. Guided by
letters handwritten from their fathers from the battlefield, they embark on an
unforgettable journey to The Wall—the Vietnam Veterans Memorial in
Washington, D.C. Along the way, they discover the devastation of war cannot
break the love of a father for his son.

Beginning July 1, stand up for faith, freedom and fatherhood as Pure Flix, the
studio that created GOD’S NOT DEAD, presents FAITH OF OUR FATHERS. A
story of fatherhood. A journey of brotherhood.",Faith Of Our Fathers,,publish,0,closed,,fight-of-our-fathers,,,2017-06-01 22:21:06,2017-06-01 22:21:06,,0,http://lovell-fairchild.dev//?post_type=clients&#038;p=260,57,clients,,0,,http://lovell-fairchild.dev//wp-content/uploads/2017/03/faith_of_our_fathers.jpg,,field_58ade3ae908d7,166,field_58dabaae72c48,,field_58dabbab72c49,http://faithofourfathersmovie.com/,field_58f1567cc0ddb,https://drive.google.com/drive/folders/0B7NzR-q_QBryVUUwczN6VGpUa1E,field_5900d5e0fc781,
261,1,2017-04-14 16:03:35,2017-04-14 16:03:35,"Until Provident/Sherwood’s FACING THE GIANTS and FIREPROOF, Christian films fell generally into one of two groups: 1) THE PASSION and 2) apocalyptic thrillers. Then came the films from Albany GA, written by Christians for Christians, finally normalizing on screen what it means to believe in God, through Christ, in all the things that come with real, daily life. Keeping the Sherwood model, FIREPROOF had an all-volunteer cast and circled any proceeds back into ministry. Former teen television star Kirk Cameron played the lead, firefighter Caleb Holt—able to rescue strangers but at a loss to save his own marriage. His story and redemption echoed in lives around the world. FIREPROOF was the no. 1 independent film of 2008, opening at no. 4 in the nation, bringing in $33 million at the box office. That’s the tip of the statistical iceberg, including record-breaking DVD sales in dozens of languages—and it shows few signs of cooling.",Fireproof,,publish,0,closed,,fireproof,,,2017-06-22 20:09:45,2017-06-22 20:09:45,,0,http://lovell-fairchild.dev//?post_type=clients&#038;p=261,61,clients,,0,,field_58ade3ae908d7,512,field_58dabaae72c48,,field_58dabbab72c49,http://www.fireproofthemovie.com/redirect.html,field_58f1567cc0ddb,,http://lovell-fairchild.dev//wp-content/uploads/2017/04/fireproof.jpg,https://drive.google.com/drive/folders/0B7NzR-q_QBryeDlwSjgyRU5BMG8,field_5900d5e0fc781,,field_59372df65dbf8,
262,1,2017-04-14 16:06:22,2017-04-14 16:06:22,"In the movie “Four Blood Moons,” produced by Rick Eldridge and directed by the Academy Award Winner, Kieth Merrill; these veteran film makers illustrate this fascinating phenomenon in a very compelling docu-drama.

Cinematic recreations of historical events from the United States, Israel and throughout the Middle East; along with expert testimonials from scientists, historians and religious scholars, are used to illustrate this story told in narrative format by a celebrity host.",Four Blood Moons,,publish,0,closed,,four-blood-moons,,,2017-06-22 20:10:39,2017-06-22 20:10:39,,0,http://lovell-fairchild.dev//?post_type=clients&#038;p=262,65,clients,,0,,field_58ade3ae908d7,513,field_58dabaae72c48,,field_58dabbab72c49,http://fourbloodmoonsmovie.com/,field_58f1567cc0ddb,,http://lovell-fairchild.dev//wp-content/uploads/2017/04/fourbloodmoonsposter27x40.jpg,https://drive.google.com/drive/folders/0B7NzR-q_QBrycjl3dklSNDBJYXc,field_5900d5e0fc781,,field_59372df65dbf8,
267,1,2017-04-14 16:35:40,2017-04-14 16:35:40,"Based on the #1 New York Times best-selling book of the same name, HEAVEN IS FOR REAL brings to the screen the true story of a small-town father who must find the courage and conviction to share his son’s extraordinary, life-changing experience with the world.

The film stars Academy Award® nominee and Emmy® award winning actor Greg Kinnear as Todd Burpo and co-stars Kelly Reilly as Sonja Burpo, the real-life couple whose son Colton (newcomer Connor Corum) claims to have visited Heaven during a near death experience. Colton recounts the details of his amazing journey with childlike innocence and speaks matter-of-factly about things that happened before his birth . . . things he couldn't possibly know. Todd and his family then are challenged to examine the meaning from this remarkable event.",Heaven Is For Real,,publish,0,closed,,heaven-is-for-real,,,2017-06-22 20:11:16,2017-06-22 20:11:16,,0,http://lovell-fairchild.dev//?post_type=clients&#038;p=267,74,clients,,0,,field_58ade3ae908d7,514,field_58dabaae72c48,,field_58dabbab72c49,https://www.facebook.com/HeavenIsForRealMovie/,field_58f1567cc0ddb,,http://lovell-fairchild.dev//wp-content/uploads/2017/04/heavenisreal.jpg,https://drive.google.com/drive/folders/0B7NzR-q_QBryYjIxVG43NC1uc0U,field_5900d5e0fc781,,field_59372df65dbf8,
268,1,2017-04-14 16:52:44,2017-04-14 16:52:44,"In Our Hands is the story of Israel’s 55th Paratrooper Brigade. With firsthand interviews and historical reenactments, this exclusive docudrama focuses on the soldiers who reunified Jerusalem and announced to the world, “The Temple Mount is in our hands.”

In Our Hands will be released worldwide in June 2017 to mark the 50th Anniversary of the Six-Day War.

Visit Website",In Our Hands,,publish,0,closed,,in-our-hands,,,2017-06-01 22:21:07,2017-06-01 22:21:07,,0,http://lovell-fairchild.dev//?post_type=clients&#038;p=268,82,clients,,0,,field_58ade3ae908d7,,field_58dabaae72c48,,field_58dabbab72c49,http://inourhands1967.com/,field_58f1567cc0ddb,https://drive.google.com/drive/folders/0B7NzR-q_QBrySkNYMXhaYk1FSXc,field_5900d5e0fc781,
