291,1,2017-04-14 17:16:41,2017-04-14 17:16:41,"n a jungle war of survival, they learned sacrifice. In a prison of brutal confinement, they found true freedom.
Scheduled for a summer release.

Staring Kiefer Sutherland, Robert Carlyle

To End All Wars opened in theaters on 9/11 when terrorists attacked the US—and this important World War II movie quickly disappeared from public awareness. Now, in the year of its 10th anniversary, this magnificent film of suffering and redemption returns to theaters—starring Kiefer Sutherland, Robert Carlyle, and Sakae Kimura–directed by David Cunningham. The Director’s Cut restores several important faith scenes.

Based on the autobiography of Ernest Gordon (later a seminary chaplain), To End All Wars recounts the struggles and faith of four Allied POWS in a brutal Japanese labor camp. Ultimately the men, mainly from a Scottish regiment, find true freedom by forgiving their enemies.

To End All Wars received the Crystal Heart Award and Grand Prize for Dramatic Feature at the Heartland Film Festival.",To End All Wars,,publish,0,closed,,to-end-all-wars,,,2017-06-01 22:21:08,2017-06-01 22:21:08,,0,http://lovell-fairchild.dev//?post_type=clients&#038;p=291,187,clients,,0,,field_58ade3ae908d7,645,field_58dabaae72c48,,field_58dabbab72c49,,http://lovell-fairchild.dev//wp-content/uploads/2017/04/end-all-wars-small.jpg,,field_58f1567cc0ddb,https://drive.google.com/drive/folders/0B7NzR-q_QBryRTRkd0VERWd0ZzA,field_5900d5e0fc781,
292,1,2017-04-14 17:17:21,2017-04-14 17:17:21,"Twenty Feet From Stardom presents rare archival footage, a peerless soundtrack and intimate interviews with Stevie Wonder, Bruce Springsteen, Mick Jagger and Sting, to name a few. Such world-famous figures take a backseat, however, to the backup singers whose lives and stories now move to center stage.

Enter Dr. Mabel John, former solo artist who joined the “Raelettes,” backing up music legend Ray Charles. Dr. John now sings from the pulpit at Joy in Jesus Ministries where she has returned to her church and gospel roots.

Triumphant and heartbreaking in equal measure, the film is both a tribute to the unsung voices that brought shape and style to popular music and a reflection on the conflicts, sacrifices and rewards of a career spent harmonizing with others.",Twenty Feet From Stardom,,publish,0,closed,,twenty-feet-from-stardom,,,2017-06-01 22:21:08,2017-06-01 22:21:08,,0,http://lovell-fairchild.dev//?post_type=clients&#038;p=292,189,clients,,0,,field_58ade3ae908d7,515,field_58dabaae72c48,,field_58dabbab72c49,http://twentyfeetfromstardom.com/,field_58f1567cc0ddb,,http://lovell-fairchild.dev//wp-content/uploads/2017/04/irresistible.jpg,
293,1,2017-04-14 17:17:55,2017-04-14 17:17:55,"Based on the inspirational true story of the De La Salle Spartans and visionary Coach Bob Ladouceur (Jim Caviezel), who led a struggling high school football team to 12 undefeated seasons, the longest winning streak in American sports history, through his unyielding focus on character-building, faith, responsibility and commitment. In doing so, he created one of the country’s greatest football dynasties.",When The Game Stands Tall,,publish,0,closed,,when-the-game-stands-tall,,,2017-06-01 22:21:08,2017-06-01 22:21:08,,0,http://lovell-fairchild.dev//?post_type=clients&#038;p=293,201,clients,,0,,field_58ade3ae908d7,519,field_58dabaae72c48,,field_58dabbab72c49,http://www.sonypictures.com/movies/whenthegamestandstall/,field_58f1567cc0ddb,,http://lovell-fairchild.dev//wp-content/uploads/2017/04/whenthegame.jpg,https://drive.google.com/drive/folders/0B7NzR-q_QBryNl9RMGoxSTJDRTA,field_5900d5e0fc781,
294,1,2017-04-14 17:18:30,2017-04-14 17:18:30,"Bishop T.D. Jakes’ 2004 movie (his first), WOMAN, THOU ART LOOSED!, began, to go to the very beginning, in pastoral counseling with women in West Virginia.  What the pastor learned in those sessions led to Sunday School classes that rapidly filled, leading to seminars, a wildly bestselling book of the same name, and ever-larger conferences.  Eventually a “Woman, Thou Art Loosed” conference in the Georgia Dome drew its largest crowd, ever. (Check the plaque on the side of The Dome.)  In every venue, with characteristic empathy and insight, Bishop Jakes aired deep wounds and applied hope.  Lovell-Fairchild was privileged to travel to major US cities and work with top US media, promoting the movie that charged audiences because it spared neither hurt nor hope—and opened at ninth in the nation.",Women Thou Art Loosed,,publish,0,closed,,women-thou-art-loosed,,,2017-06-22 21:26:36,2017-06-22 21:26:36,,0,http://lovell-fairchild.dev//?post_type=clients&#038;p=294,205,clients,,0,,field_58ade3ae908d7,,field_58dabaae72c48,,field_58dabbab72c49,,field_58f1567cc0ddb,https://drive.google.com/drive/folders/0B7NzR-q_QBrydk1uUUt5Qk1idHc,field_5900d5e0fc781,,field_59372df65dbf8,
295,1,2017-04-14 17:20:29,2017-04-14 17:20:29,"The Buchanans’ precious son Christian was born with a medical condition that is so incredibly unique, it’s one of only fifty known cases in the world. This story has captured the hearts of hundreds of thousands.",Through The Eyes Of Hope,,publish,0,closed,,through-the-eyes-of-hope-2,,,2017-06-01 22:21:08,2017-06-01 22:21:08,,0,http://lovell-fairchild.dev//?post_type=clients&#038;p=295,186,clients,,0,,field_58ade3ae908d7,,field_58dabaae72c48,,field_58dabbab72c49,https://www.youtube.com/watch?v=Lnd-eNaU1PI,field_58f1567cc0ddb,https://drive.google.com/drive/folders/0B7NzR-q_QBryMVJfckZaRzhqMFk,field_5900d5e0fc781,
296,1,2017-04-14 17:22:39,2017-04-14 17:22:39,"What does it take to feel good--and do good--in work? More money? Money falls short, says Dean Niewolny, whose finance career, four houses, boat, plane, and astronomical paycheck still left him restless. Call it smoldering discontent. Like most achievers, Dean found himself craving work that matters.

So Dean took the hard road to trade up, eventually landing at the helm of Halftime.

Now for almost anyone in any career--just starting, midway, or wrapping up--Dean has the goods. With deep insight from his personal journey, Dean lays out the path to a career with purpose. (Sometimes the career changes; always the heart does.) Readers get self-assessment tools and clear steps wrapped in twenty years worth of stories, hard-won wisdom, and grace. A person can know what he or she was wired to do--and how to get there.",Trade Up By Dean Niewolny,,publish,0,closed,,trade-up-by-dean-niewolny,,,2017-06-01 22:21:08,2017-06-01 22:21:08,,0,http://lovell-fairchild.dev//?post_type=clients&#038;p=296,188,clients,,0,,field_58ade3ae908d7,,field_58dabaae72c48,,field_58dabbab72c49,http://bakerpublishinggroup.com/books/trade-up/382270,field_58f1567cc0ddb,https://drive.google.com/drive/folders/0B7NzR-q_QBryU0EzdnpzMDluUFU,field_5900d5e0fc781,
297,1,2017-04-14 17:23:38,2017-04-14 17:23:38,"Imagine if you discovered a treasure chest in which were hidden ancient mysteries, revelations from heaven, secrets of the ages, the answers to man’s most enduring, age-old questions, and the hidden keys that can transform your life to joy, success, and blessing...This is The Book of Mysteries.

Jonathan Cahn, who caused a national and international stir with the New York Times best-seller The Harbinger and then The Mystery of the Shemitah, now brings us a treasure chest inside of which are contained some of the greatest mysteries of all time. The reader will discover life-transforming secrets, mind- blowing realities, and heart-changing revelations in such mysteries as the Face in the Waters, the Leper King, the Land of Gezarah, the Secret of the Third Prince, the House of Spirits, the Mystery of the Rains, How to Alter Your Past, the Second Scroll, the Similitude, the Mystery of the Eighth Day, and much more. The Book of Mysteries takes the readers on a journey of divine revelation through ancient Scriptures, the laws of Creation, the deep of God’s Word, the hidden streams of history, the most important keys of spiritual truth, end-time mysteries, and the secrets of life.

The Book of Mysteries opens up with a traveler and his encounter with a man known only as “the teacher.” The teacher takes him an on odyssey through desert mountains, valleys, gardens and plains, encounters with nomadic tent dwellers, caverns and ancient ruins, chambers of scrolls and vessels, and more. The reader is taken along to partake in the journey and in all the teachings and revelations. The traveler keeps a journal in which he writes down each of the mysteries given to him by the teacher in his one-year odyssey—365 different mysteries—one for each day of the year. Thus, on top of everything else, The Book of Mysteries is also a daily devotional unlike any other. And each mystery contains a special mission for each day of the year, a mission that takes the revelation and applies it to reality for a life-changing journey.",The Book Of Mysteries,,publish,0,closed,,book-of-mysteries,,,2017-07-12 16:34:30,2017-07-12 16:34:30,,0,http://lovell-fairchild.dev//?post_type=clients&#038;p=297,149,clients,,0,,field_58ade3ae908d7,526,field_58dabaae72c48,,field_58dabbab72c49,,field_58f1567cc0ddb,,http://lovell-fairchild.dev//wp-content/uploads/2017/04/screenshot20160808at3.00.49pm-1.jpg,https://drive.google.com/drive/folders/0B7NzR-q_QBrySExfSEhGWVVTUTQ,field_5900d5e0fc781,
298,1,2017-04-14 17:24:45,2017-04-14 17:24:45,"How to love fearlessly--even when we disagree

In an age when we are as connected as we are contentious, an astounding number of religious, cultural, and political polarities do more to divide us than unite us. In fact, Christians are getting the reputation of being ""against"" just about everything. But is this the best way to bear witness to the love of God before an unbelieving world? Or does it simply serve to push others further and further away from the life-giving power of Jesus?

Perhaps it is time to trade condemnation for compassion.

Story-driven and biblically based, No Fear in Love challenges us to love others the way God loves us--unconditionally, brokenness and all--and to trust that God is truly in control.
""Braner nails it. No simple platitudes here; just real-life stories soaked in truth that will set you free.""--Carl Medearis, author of Adventures in Saying Yes: A Journey from Fear to Faith

""The pathway of authentic love has led Andy past fear and into that wonderful, adventurous place where 'the other' becomes a friend. Like Andy, I'm learning that's often where Jesus does his best work in and through us.""--Lynne Hybels, advocate for global engagement, Willow Creek Community Church

""This is a critical and timely book that demands serious attention and reflection.""--Bob Roberts Jr., author of Bold as Love and senior pastor of Northwood Church
Andy Braner is the founder of Ahava Ministries, a nonprofit youth ministry that teaches teens and college students to think about the world through a Jesus paradigm. A popular blogger, he speaks to over 100,000 students, parents, and teachers every year at churches, conferences, and personal tours. He has appeared on CBN, Fox News, and various other media outlets, and lives in Colorado.",No Fear In Love By Andy Braner,,publish,0,closed,,no-fear-in-love-2,,,2017-07-12 16:34:37,2017-07-12 16:34:37,,0,http://lovell-fairchild.dev//?post_type=clients&#038;p=298,113,clients,,0,,field_58ade3ae908d7,525,field_58dabaae72c48,,field_58dabbab72c49,,field_58f1567cc0ddb,,http://lovell-fairchild.dev//wp-content/uploads/2017/04/nofearinlove.jpg,https://drive.google.com/drive/folders/0ByOkI5fqrxmlT0tvMGx6U1ZXV1k,field_5900d5e0fc781,
299,1,2017-04-14 17:26:18,2017-04-14 17:26:18,"BATTLES ARE RAGING BETWEEN ANGELS AND DEMONS OVER YOU

John Hagee’s breathtaking biblical tour of the three heavens takes you inside the timeless clash between the Kingdom of Light and the Kingdom of Darkness and explains why that battle makes all the difference in this world and the world to come.",The Three Heavens,,publish,0,closed,,the-three-heavens-2,,,2017-06-01 22:21:08,2017-06-01 22:21:08,,0,http://lovell-fairchild.dev//?post_type=clients&#038;p=299,180,clients,,0,,field_58ade3ae908d7,520,field_58dabaae72c48,,field_58dabbab72c49,,http://lovell-fairchild.dev//wp-content/uploads/2017/04/9781617953699.jpg,,field_58f1567cc0ddb,https://drive.google.com/drive/folders/0B7NzR-q_QBryTnd4b2tjX2xaNm8,field_5900d5e0fc781,
300,1,2017-04-14 17:26:58,2017-04-14 17:26:58,"Is comparison living hijacking your life?

Do you find yourself measuring your value against your friend’s house, body, marriage, resume, paycheck, organic garden, or Pinterest-worthy holiday décor, and coming up lacking? Do your college roommate’s Instagram snapshots bear little resemblance to the scene at your house this morning?

Excessive comparison and competition sap our energy and steal our joy. Our friends become our audience and judges, and our kids become part of our brand. Add social media’s constant invitation to post and peruse, and it’s no wonder that we’re left exhausted, discontent, and lonely. Thankfully, there is another way!

With refreshing candor and humor, Kay Wyma shares her experiences with comparison living and offers readers the simple remedies that helped her and her family reboot their perspective and discover freedom, authenticity, and joy.

Kay Wills Wyma has five kids, ages four to fourteen, and one SUV with a lot of carpool miles. She holds a bachelor's from Baylor University and an MIM from the American Graduate School of International Management (Thunderbird). Before transitioning to stay-at-home mom, she held positions at the White House, the Staubach Company, and Bank of America. She and her husband, Jon, live with their family in the Dallas area.",I'm Happy For You Kay Wyma,,publish,0,closed,,im-happy-for-you-2,,,2017-06-01 22:21:07,2017-06-01 22:21:07,,0,http://lovell-fairchild.dev//?post_type=clients&#038;p=300,79,clients,,0,,field_58ade3ae908d7,,field_58dabaae72c48,,field_58dabbab72c49,http://www.themoatblog.com/im-happy-for-you-sort-of-not-really/,field_58f1567cc0ddb,https://drive.google.com/drive/folders/0B7NzR-q_QBryRFRCQ0RMRkk4Qmc,field_5900d5e0fc781,
301,1,2017-04-14 17:28:03,2017-04-14 17:28:03,"“Kerry and Chris Shook give us a powerful guide on how to stop hiding behind our image and truly discover and live our authentic life message.” Rick Warren, Pastor of Saddleback Church and author of the New York Times #1 Best-seller The Purpose Driven Life

Are you troubled by the disconnect between the words you speak and the life you live? Do you find it easier to offer words instead of actions? Would you like to see your faith become more active and life-changing in the world around you? Pastors Kerry and Chris Shook, founders of Woodlands Church outside of Houston, felt that way. Even though their calling involved preaching and teaching, they became weary of sermons and words. They felt a gap between what they were saying and meeting the needs of people around them. They decided to do something about it.

In a nutshell, they chose to talk about God less and walk with God more. Be the Message is their story of waking up to the gospel-not just a gospel of words and sermons, but the gospel of intention and action and people—and how doing so changed their family, church and personal relationship with God. It’s their story of taking one step after another to live out God’s gospel in the world. And it’s their call for us to do the same.

“Something shifts inside you when your faith is acted out,” they write. Indeed, one of the profound secrets they discovered is “You are the gospel.” The verse “the word of God lives in you” is really about life message—your life lived out, and it’s different for everyone.

For the Shooks being God’s hand and feet in the world played out in countless and different ways from converting their local church bookstore into one of the largest fair trade/direct trade stores in the country to helping a post-earthquake remote village in Haiti transform and sustain itself by learning how to produce 4x more coffee.

But their story is not intended to call everyone to a life mission overseas. Each person brings uniqueness to how he or she lives out the gospel. Be the Message provides a roadmap to the possibilities ultimately serving as an inspirational, idea-filled look at making our lives shout through actions not words.

“Our goal is that by the end of the book you will be able to clearly see the life message of Jesus and you’ll also have a much clearer view of what your own life message is, the way that God wants to walk and speak and reach others through you so that you can not only read the message but be the message.”

Along the way, the Shooks wisely remind us that God never asks us to do something big for Him. He asks us to take small steps of faith so He can do something big in us and through us.",Be The Message By Kerry And Chris Shook,,publish,0,closed,,be-the-message-2,,,2017-07-10 18:58:11,2017-07-10 18:58:11,,0,http://lovell-fairchild.dev//?post_type=clients&#038;p=301,17,clients,,0,,field_58ade3ae908d7,522,field_58dabaae72c48,,field_58dabbab72c49,http://www.bethemessagebook.com/,field_58f1567cc0ddb,,http://lovell-fairchild.dev//wp-content/uploads/2017/04/bethemessage.jpg,https://drive.google.com/drive/folders/0B7NzR-q_QBryMkJnTENsQTViZjg,field_5900d5e0fc781,
302,1,2017-04-14 17:29:14,2017-04-14 17:29:14,"Finding Your Radiance in the Imperfections of Your Life

Struggling with her identity while living a life of unfulfilled dreams and hidden secrets, Shari Rigby takes readers on the adventure known as life. From wild teenager dealing with pregnancy, marriage, adultery, drugs and rock n roll, to career woman desperately searching for love but finding it in the wrong places, Shari’s journey is an inspiring story that teaches us our painful pasts can open doors to a hopeful future.

ABOUT THE AUTHOR
Shari Rigby began a career in acting at an age when most actresses were retiring. Her most recent projects include The Summers Sisters TV pilot, BOONEVILLE REDEMPTION and WILDFLOWER, releasing 2015. Previous works include NOT TODAY, which received seven awards, and OCTOBER BABY, named one of the Top 15 Impressive Box Office Performances of 2012 by CNN.

Shari is currently working on creating faith-based film and television, Bible studies and women's conferences. She speaks to thousands of people at churches and conferences and is a regular guest on radio and television programs-appearing on CBN, TBN, American Family Radio, Focus on the Family, K-Love Radio and many more. She is founder of The Women in My World, a women's group focusing on identity, purpose, ministry and living life in Hollywood. Shari is also a devoted mother to two boys, Donnie and Levi, and has been married to her husband, Matt, for 17 years.",Beautifully Flawed By Shari Rigby,,publish,0,closed,,beautifully-flawed-2,,,2017-07-10 18:58:11,2017-07-10 18:58:11,,0,http://lovell-fairchild.dev//?post_type=clients&#038;p=302,18,clients,,0,,field_58ade3ae908d7,,field_58dabaae72c48,,field_58dabbab72c49,http://www.bethemessagebook.com/,field_58f1567cc0ddb,https://drive.google.com/drive/folders/0B7NzR-q_QBrybEZPUHhsc0V6dzA,field_5900d5e0fc781,
303,1,2017-04-14 17:30:17,2017-04-14 17:30:17,"JOE BATTAGLIA is Founder and President of Renaissance Communications, a company specializing in providing media platforms for organizations and gifted communicators of the faith and values message, whose clients include Dr. Steve Brown and the Key Life Radio Network, Affirm Films/Sony Pictures Entertainment, Provident Films, actress Shari Rigby, author/pastor Tullian Tchividjian, Pure Flix Entertainment, and Feed The Children.

Renaissance has been heavily involved in the promotion of successful hit movies to the faith-based marketplace, such as The Passion, The Lion, The Witch &amp; The Wardrobe, The Polar Express, Facing the Giants, Fireproof, Courageous, Soul Surfer, Son of God, God’s Not Dead, Heaven Is For Real, The Giver, When the Game Stands Tall, and Left Behind.

Joe is also Executive Producer and General Manager, Keep The Faith Radio, a nationally syndicated radio program heard in over 200 markets and 80 countries overseas.

Highly active in the Christian music industry, Joe served on the board of Gospel Music Association (GMA) for 19 years, was chairman of the National Christian Radio Association (NCRS) for 14 years, and currently sits on the boards of the Walter Hoving Home in Garrison, New York and the WAY-FM Radio Network.

Prior to forming Renaissance in 1992, Joe was VP of Communicom Corp. of America, the then parent company of WWDJ/New York, WZZD/Philadelphia, and KSLR/San Antonio. He was with Communicom for over 18 years, eight as General Manager of the flagship station WWDJ from 1982–1990.

From1979–1995, he also was a partner in Living Communications, parent company of WLIX, Long Island, NY and WLVX, Hartford, CT.

In 1991, Joe penned his first book, A New Suit for Lazarus (Thomas Nelson). He attended Boston University, graduating magna cum laude with a BS in Journalism. Joe can still be found at times hanging around some street corners in North Jersey with old friends singing doo-wop songs, because that’s where Jesus might be if He were around today.",The Politically Incorrect Jesus,,publish,0,closed,,the-politically-incorrect-jesus,,,2017-07-12 16:34:31,2017-07-12 16:34:31,,0,http://lovell-fairchild.dev//?post_type=clients&#038;p=303,169,clients,,0,,field_58ade3ae908d7,521,field_58dabaae72c48,,field_58dabbab72c49,http://www.thepoliticallyincorrectjesus.com/,field_58f1567cc0ddb,,http://lovell-fairchild.dev//wp-content/uploads/2017/04/97814245498183.jpg,https://drive.google.com/drive/folders/0B7NzR-q_QBryZWtnWXFuOGExTVE,field_5900d5e0fc781,
